name,lat,lng,location,state,condition,pricing,rating,image_url,ai_summary
Kamuku National Park,10.8239,6.0694,"Birnin Gwari, Kaduna",Kaduna,Good,Paid Entry,4.7,,A spectacular park in Kaduna known for wildlife and diverse flora.
Matsirga Waterfalls,9.6000,8.2833,"Kafanchan, Kaduna",Kaduna,Good,Free Access,4.8,,Breathtaking waterfalls offering natural pools for swimming and scenic trails.
Millennium Park,9.0765,7.4951,"Maitama, Abuja",Abuja,Excellent,Free Access,4.9,,The largest public park in Abuja featuring fountains and well-kept nature paths.
National Childrens Park and Zoo,9.0601,7.5247,"Asokoro, Abuja",Abuja,Average,Paid Entry,4.4,,A family-friendly destination featuring playgrounds and animal exhibits.
Agbokim Waterfalls,5.9897,8.7303,"Ikom, Cross River",Cross River,Good,Paid Entry,4.8,,Stunning seven-stream waterfall cascading over a steep cliff surrounded by lush forest.
Yankari National Park,9.7500,10.5000,"Bauchi, Bauchi State",Bauchi,Excellent,Paid Entry,4.9,,A large wildlife park that features the famous Wikki Warm Springs and diverse wildlife.
Kajuru Castle,10.3233,7.6744,"Kajuru Village, Kaduna",Kaduna,Excellent,Paid Entry,4.8,,An exclusive luxury resort built in a medieval style right in Kaduna.
Jos Wildlife Park,9.8860,8.8899,"Jos, Plateau",Plateau,Average,Paid Entry,4.3,,One of the largest man-made zoological gardens in Nigeria with pine forests.
